http://ec.europa.eu/esco/skill/20745,7QC (The Seven Quality Control Tools),Business administrator-Quality coordination adviser-Quality auditor-Household adviser
http://ec.europa.eu/esco/skill/20749,7QM (The Seven Quality Management Tools),Business administrator-Quality auditor-Quality coordination adviser-Household adviser
http://ec.europa.eu/esco/skill/17599,À la carte cooking,Cook (ship)-Assistant chef-Chef-Grill cook-Head chef-Chinese cook-First cook-Cook steward-Dietetic cook-Special cook-Chief cook-Cook
http://ec.europa.eu/esco/skill/23087,Acceptance of orders,Transport adviser-Transport coordinator-Transport planner-Agent (music)-Manager-Housing agent-Letting agent-Shipping agent (business services agents and trade brokers)-Shipping master-Shipping planner-Transport administrator-Artists' agent-Ship-broker-Artists' booking agent-Transport engineer-Shipping company agent-Aircraft broker-Literary agent-Distribution supervisor-Booking agent-Charterer
http://ec.europa.eu/esco/skill/23259,Accommodation agency,Cottage manager-Assistant (tourist information office)-Ticket seller (travel agency)-Charter travel salesperson-Travel agent-Private travel agent-Travel agency assistant-Traffic assistant-Tourist information officer-Sales director (travel agency)-Secretary (tourist information office)-Travel agency employee-Business travel salesperson-Booking officer (travel agency)-Employee (tourist information office)-Travel agency clerk-Traffic information officer-Booking assistant (travel agency)
http://ec.europa.eu/esco/skill/23442,Account coding,Chief receptionist-Hotel receptionist-Bookings manager (hotel)-Bookings clerk (hotel)-Conference host/hostess (receptionists and information clerks)-Boarding house host-Night receptionist-Youth hostel director-Office cashier-Course host/hostess-Night porter-Farming cashier-Cash office worker-Conference manager-Hotel host-Porter (receptionists and information clerks)-Receptionist (telephone operator)-Office receptionist
http://ec.europa.eu/esco/skill/21420,Accounting / auditing,Union treasurer-Business administrator-Quality auditor-Household adviser-Quality coordination adviser
http://ec.europa.eu/esco/skill/22539,Actuate e.Report,Business administrator
http://ec.europa.eu/esco/skill/22973,Acupuncture,Alcohol therapist
http://ec.europa.eu/esco/skill/21586,Administration of wages,Office cashier-Farming cashier-Cash office worker
http://ec.europa.eu/esco/skill/22656,Adobe Authorware,Language reviser
http://ec.europa.eu/esco/skill/17132,Adolescent psychology,Psychotherapist-Psychologist-School psychologist-Group therapist-Conversational therapist-Child therapist-Child psychologist-Therapist-Family therapist-Individual therapist-Clinical psychologist-Psychoanalyst
http://ec.europa.eu/esco/skill/15172,Adult education (teaching),Driving school manager-Golf course supervisor
http://ec.europa.eu/esco/skill/17355,Adult rehabilitation,Alcohol therapist
http://ec.europa.eu/esco/skill/16375,Advertisement production (wording),Language reviser
http://ec.europa.eu/esco/skill/19376,Advertisement reception,Housing agent-Letting agent
http://ec.europa.eu/esco/skill/21547,Advertising services,"Advertising seller (door-to-door and telephone salespersons, shop sales persons and demonstrators)-Leasing manager-Kiosk assistant-Kiosk owner"
http://ec.europa.eu/esco/skill/18799,Aesthetics,Humanist (researcher)-Ideas historian-Cultural scientist-Futurologist-Philosopher (scientist)
http://ec.europa.eu/esco/skill/22995,African archaeology,Archaeological scientist-Anthropologist-Archaeologist-Marine archaeologist
http://ec.europa.eu/esco/skill/18614,Air decontamination,Cleaner-up
http://ec.europa.eu/esco/skill/16866,Air freight,Transport adviser-Transport coordinator-Transport planner-Agent (music)-Shipping master-Shipping planner-Transport administrator-Shipping agent (business services agents and trade brokers)-Artists' agent-Transport engineer-Shipping company agent-Distribution supervisor-Charterer
http://ec.europa.eu/esco/skill/19920,Aircraft cleaning,Cleaning foreman-Cleaning instructor-Industry cleaner-Cabin attendant-Supervisor (cleaning)-Team supervisor (cleaning)-Head cleaner-Aircraft cleaner
http://ec.europa.eu/esco/skill/17630,Alarm and safety products,"Advertising seller (door-to-door and telephone salespersons, shop sales persons and demonstrators)"
http://ec.europa.eu/esco/skill/19891,Alphabetic data recording,Complaints officer
http://ec.europa.eu/esco/skill/23895,Amadeus (travel reservation system),Ground hostess-Air traffic assistant-Cottage manager-Assistant (tourist information office)-Ticket seller (travel agency)-Travel agent-Travel agency assistant-Private travel agent-Charter travel salesperson-Traffic assistant-Tourist information officer-Check-in assistant-Secretary (tourist information office)-Sales director (travel agency)-Travel agency employee-Booking officer (travel agency)-Traffic information officer-Service manager (air traffic)-Employee (tourist information office)-Business travel salesperson-Travel agency clerk-Booking assistant (travel agency)
http://ec.europa.eu/esco/skill/16521,Ancient archaeology,Archaeological scientist-Anthropologist-Archaeologist-Marine archaeologist
http://ec.europa.eu/esco/skill/20302,Ancient monument records,Archaeological scientist-Anthropologist-Archaeologist-Marine archaeologist
http://ec.europa.eu/esco/skill/19789,Ancient monuments inventory,Archaeological scientist-Anthropologist-Archaeologist-Marine archaeologist
http://ec.europa.eu/esco/skill/18368,Animation (architecture),Landscape gardener-Town planner-Land use planner
http://ec.europa.eu/esco/skill/23828,Annual accounts audit,Union treasurer
http://ec.europa.eu/esco/skill/18043,Anthropology,Archaeological scientist-Legal sociologist-Criminologist-Anthropologist-Archaeologist-Geographer-Social anthropologist-Ethnologist
http://ec.europa.eu/esco/skill/23762,Antique valuation,Auctioneer-Auctioneer's assistant-Chief auctioneer
http://ec.europa.eu/esco/skill/15839,Aphasia care,Companion
http://ec.europa.eu/esco/skill/22834,Applied statistics,Business administrator-Quality auditor-Quality coordination adviser-Household adviser
http://ec.europa.eu/esco/skill/21076,Archaeology,Historian (researcher)-Humanist (researcher)-Ideas historian-Cultural scientist
http://ec.europa.eu/esco/skill/17180,ArchiCAD,Landscape gardener-Land use planner-Town planner
http://ec.europa.eu/esco/skill/18124,Architectural models,Landscape gardener-Land use planner-Town planner
http://ec.europa.eu/esco/skill/16125,Area responsibility (educational issues),Manager of an employment mediation office
http://ec.europa.eu/esco/skill/21596,Area responsibility (labour market issues),Manager of an employment mediation office
http://ec.europa.eu/esco/skill/21306,Area responsibility (social insurance issues),Manager of an employment mediation office
http://ec.europa.eu/esco/skill/15587,Ariba,Business administrator
http://ec.europa.eu/esco/skill/16033,ARIS Platform,Business administrator
http://ec.europa.eu/esco/skill/23651,Art valuation,Auctioneer-Auctioneer's assistant-Chief auctioneer
http://ec.europa.eu/esco/skill/15697,Artists' booking agency,Manager-Agent (music)-Artists' agent-Literary agent-Artists' booking agent-Booking agent
http://ec.europa.eu/esco/skill/19885,Asbestos decontamination,Industry cleaner-Attendant-Team supervisor (cleaning)
http://ec.europa.eu/esco/skill/23035,Asian archaeology,Archaeological scientist-Anthropologist-Archaeologist-Marine archaeologist
http://ec.europa.eu/esco/skill/23444,Asset management,Business administrator-Quality coordination adviser-Quality auditor-Household adviser-Estate manager-Estate director
http://ec.europa.eu/esco/skill/22428,ASW (business administration system),Office cashier-Cash office worker
http://ec.europa.eu/esco/skill/14256,Audio-visual tools,Conference host/hostess (receptionists and information clerks)-Course host/hostess-Conference manager
http://ec.europa.eu/esco/skill/18745,Auditing,Union treasurer
http://ec.europa.eu/esco/skill/15903,Autism care,Companion
http://ec.europa.eu/esco/skill/15828,AutoCAD,Landscape gardener-Land use planner-Town planner
http://ec.europa.eu/esco/skill/16532,AutoCAD Architecture,Land use planner-Town planner-Traffic planner (railways)
http://ec.europa.eu/esco/skill/21677,AutoCAD Civil 3D,Land use planner-Traffic planner (railways)-Town planner
http://ec.europa.eu/esco/skill/22297,AutoCAD LT,Land use planner-Town planner-Traffic planner (railways)
http://ec.europa.eu/esco/skill/14731,AutoCAD Map 3D,Town planner-Land use planner-Traffic planner (railways)
http://ec.europa.eu/esco/skill/22346,AutoCAD Mechanical,Land use planner-Traffic planner (railways)-Town planner
http://ec.europa.eu/esco/skill/15806,Automation technology,Industrial hygienist
http://ec.europa.eu/esco/skill/23459,Backoffice,Business administrator-Quality auditor-Quality coordination adviser-Office cashier-Broker's assistant-Church cashier-Cash office worker
http://ec.europa.eu/esco/skill/18394,Baggage handling,Luggage porter
http://ec.europa.eu/esco/skill/14762,Bakery and confectionery products,"Café manager-Advertising seller (door-to-door and telephone salespersons, shop sales persons and demonstrators)-Café assistant"
http://ec.europa.eu/esco/skill/17932,Bartending,Restaurant assistant-Cabin attendant-Supply services staff (shipping)-Breakfast host/hostess-Attendant-Fast-food stand assistant-Serving assistant-Meals service assistant-Waiter/waitress-Head waiter-Bar assistant-Waiter/waitress (ship)-Sommelier-Bartender-Club host/hostess-Breakfast assistant-Waiter/waitress (café)-Valet
http://ec.europa.eu/esco/skill/15582,Basic baking,Restaurant assistant-Attendant-Breakfast host/hostess-Kitchen assistant-Assistant cook-Cash desk assistant (restaurant)-Meals service assistant-Serving assistant-Catering worker-Cash desk assistant (cafeteria)-Maintenance operative (catering)-Kitchen assistant (institution)-Breakfast assistant-School lunch assistant
http://ec.europa.eu/esco/skill/19957,Basic cleaning,"Cleaning foreman-Cleaner (helpers and cleaners in offices, hotels and other establishments)-Cleaning instructor-Industry cleaner-House cleaner-Cleaner (ship)-Stairs cleaner-Attendant-Cash desk assistant (restaurant)-Meals service assistant-Serving assistant-Supervisor (cleaning)-Cleaning worker-Team supervisor (cleaning)-Hospital cleaner-Cash desk assistant (cafeteria)-Head cleaner-Office cleaner-Construction site cleaner-Hotel cleaner-Aircraft cleaner"
http://ec.europa.eu/esco/skill/17999,Basic cooking,Restaurant assistant-Housekeeper-Domestic helper-Companion-Attendant-Breakfast host/hostess-Assistant cook-Kitchen assistant-Fast-food stand assistant-Cash desk assistant (restaurant)-Meals service assistant-Serving assistant-Catering worker-Bar assistant-Cold buffet assistant-Cash desk assistant (cafeteria)-Domestic cleaner-Maintenance operative (catering)-Club host/hostess-Kitchen assistant (institution)-Grill assistant-Child sitter (occasional)-Nanny-Domestic worker-Au pair-Child sitter-Valet-Breakfast assistant-School lunch assistant
http://ec.europa.eu/esco/skill/21137,Basic vehicle servicing,Undersealer-Labourer (general)
http://ec.europa.eu/esco/skill/22908,Beach holiday travel (guide experience),Tour guide-Guide-Wilderness guide-Sightseeing guide-Company guide-Tour leader-Local manager (travel company)-Fishing guide-Bus guide-Taxi guide-Industry guide-Courier-Local guide
http://ec.europa.eu/esco/skill/19566,Behavioural science,Archaeological scientist-Criminologist-Legal sociologist-Anthropologist-Archaeologist-Social anthropologist-Ethnologist
http://ec.europa.eu/esco/skill/19650,Behavioural therapy,Child psychologist-Child therapist-Therapist-Preschool psychologist-Conversational therapist-School psychologist-Industrial psychologist-Group therapist-Psychotherapist-Clinical psychologist-Family therapist-Psychologist
http://ec.europa.eu/esco/skill/22468,Benchmarking,Business administrator-Quality auditor-Quality coordination adviser
http://ec.europa.eu/esco/skill/14714,Bicycles,"Advertising seller (door-to-door and telephone salespersons, shop sales persons and demonstrators)"
http://ec.europa.eu/esco/skill/17779,Bliss communication,Companion
http://ec.europa.eu/esco/skill/22979,Boarding school (caretaking),Matron-Assistant matron
http://ec.europa.eu/esco/skill/14670,Boating articles,"Advertising seller (door-to-door and telephone salespersons, shop sales persons and demonstrators)"
http://ec.europa.eu/esco/skill/18046,Bocad-3D,Land use planner-Town planner-Traffic planner (railways)
http://ec.europa.eu/esco/skill/14659,Bonds,Broker's assistant
http://ec.europa.eu/esco/skill/16658,Book-keeping,Hotel receptionist-Chief receptionist-Bookings clerk (hotel)-Bookings manager (hotel)-Youth hostel director-Conference host/hostess (receptionists and information clerks)-Boarding house host-Night receptionist-Catering director-Matron-Housekeeper (hotel/restaurant)-Kitchen manager-Tour leader-Office cashier-Local manager (travel company)-Bus guide-Letting agent-Course host/hostess-Night porter-Catering supervisor-Hotel matron-Restaurant housekeeper-Church cashier-Farming cashier-Assistant matron-School meals director-Study centre director-Cash office worker-Conference manager-Hotel host-Porter (receptionists and information clerks)-Receptionist (telephone operator)-Office receptionist-Catering manager
http://ec.europa.eu/esco/skill/21871,Books and authors,"Advertising seller (door-to-door and telephone salespersons, shop sales persons and demonstrators)"
http://ec.europa.eu/esco/skill/19224,Breakfast buffet catering,Restaurant assistant-Attendant-Breakfast host/hostess-Assistant cook-Kitchen assistant-Cash desk assistant (restaurant)-Serving assistant-Meals service assistant-Bar assistant-Cold buffet assistant-Cash desk assistant (cafeteria)-Kitchen assistant (institution)-Grill assistant-Breakfast assistant
http://ec.europa.eu/esco/skill/23311,Brokerage,Broker's assistant
http://ec.europa.eu/esco/skill/16411,Bronze age archaeology,Archaeological scientist-Anthropologist-Archaeologist-Marine archaeologist
http://ec.europa.eu/esco/skill/16649,Budget design,Union treasurer
http://ec.europa.eu/esco/skill/18475,Budget follow-up,Union treasurer
http://ec.europa.eu/esco/skill/15227,Budget monitoring,Union treasurer
http://ec.europa.eu/esco/skill/15222,Budget responsibility,Transport coordinator-Transport adviser-Hotel receptionist-Bookings manager (hotel)-Transport planner-Sports agent-Manager-Agent (music)-Real estate manager-Real estate broker-Housing administrator-Real estate secretary-Head chef-Assistant chef-Boarding house host-Night receptionist-Grill cook-Cold-buffet manageress (ship)-Youth hostel director-Quality coordination adviser-Head waiter-Cold-buffet manageress-Shipping agent (business services agents and trade brokers)-Shipping master-Estate manager-Artists' agent-Catering supervisor-Assistant matron-Restaurant housekeeper-Bartender-Manager of an employment mediation office-Special cook-Sommelier-Director (residential hotel)-Director (holiday village)-Transport engineer-Artists' booking agent-Ship-broker-Restaurateur-Travel agency director-Study centre director-Rent inspector-Housing inspector-Driving school manager-Real estate inspector-Chief cook-Chief receptionist-Union treasurer-Real estate administrator-Real estate agent-Business administrator-Real estate book-keeper-Housing manager-Rent adviser-Operations manager (property)-Chef-Chinese cook-Quality auditor-Catering director-Matron-Kitchen manager-Housekeeper (hotel/restaurant)-Household adviser-Dietetic cook-Transport administrator-Shipping planner-Restaurant manager-Hotel matron-Camping ground supervisor-Travel agency manager-Rent supervisor-Estate director-School meals director-Area administrator-Aircraft broker-Cook-Conference manager-Literary agent-Booking agent-Hotel manager-Charterer-Golf course supervisor-Catering manager
http://ec.europa.eu/esco/skill/16121,Budgetary guidance,Business administrator-Quality auditor-Quality coordination adviser-Household adviser
http://ec.europa.eu/esco/skill/16982,Buffet preparation,Cook (ship)-Assistant chef-Head chef-Chef-Grill cook-Chinese cook-Cold-buffet manageress (ship)-First cook-Dietetic cook-Cook steward-Cold-buffet manageress-Special cook-Chief cook-Cook
http://ec.europa.eu/esco/skill/23097,Building inspection,Real estate administrator-Real estate agent-Housing manager-Real estate manager-Housing administrator-Real estate broker-Rent adviser-Operations manager (property)-Real estate assistant-Rent supervisor-Rent inspector-Real estate inspector-Area administrator-Housing inspector
http://ec.europa.eu/esco/skill/17880,Building maintenance (heating/water/sanitation),Building maintenance foreman-Odd-job man-Building technician-Gas meter installer-Building repairman-School porter-Water meter installer-Public baths caretaker-Sports ground worker-Caretaker (sports centre)-Caretaker (property)-Operations engineer (buildings)-Caretaker-Building maintenance engineer-Meter installer-Operations technician (buildings)-Verger-Operations manager (buildings)-Building maintenance worker-Caretaker (sports ground)
http://ec.europa.eu/esco/skill/18717,Building site cleaning,Cleaner-up
http://ec.europa.eu/esco/skill/20404,Bulldozer,Labourer (general)
http://ec.europa.eu/esco/skill/23800,Business administration,Business administrator-Quality coordination adviser-Quality auditor-Household adviser-Team supervisor (cleaning)
http://ec.europa.eu/esco/skill/20415,Business development,Business administrator-Quality auditor-Quality coordination adviser-Household adviser
http://ec.europa.eu/esco/skill/16955,Business intelligence,Business administrator-Quality coordination adviser-Quality auditor-Household adviser
http://ec.europa.eu/esco/skill/19183,Business management (camping/holiday village),Camping ground supervisor-Director (holiday village)
http://ec.europa.eu/esco/skill/15159,Business management (golf course),Golf course supervisor
http://ec.europa.eu/esco/skill/14987,Business management (sports facility),Golf course supervisor
http://ec.europa.eu/esco/skill/15017,Business management (sports hall),Golf course supervisor
http://ec.europa.eu/esco/skill/15260,Business management (training company),Driving school manager
http://ec.europa.eu/esco/skill/23342,Business travel sales,Ground hostess-Air traffic assistant-Cottage manager-Private travel agent-Traffic assistant-Travel agent-Ticket seller (travel agency)-Travel agency assistant-Tourist information officer-Secretary (tourist information office)-Sales director (travel agency)-Travel agency employee-Service manager (air traffic)-Booking officer (travel agency)-Business travel salesperson-Traffic information officer-Booking assistant (travel agency)-Travel agency clerk
http://ec.europa.eu/esco/skill/21096,CAD drawing,Patent consultant-Landscape gardener-Land use planner-Town planner
http://ec.europa.eu/esco/skill/22092,CadPoint,Landscape gardener-Land use planner-Town planner
http://ec.europa.eu/esco/skill/17295,Café (cold food preparation),Cook (ship)-Head chef-Chef-Assistant chef-Grill cook-Chinese cook-Cold-buffet manageress (ship)-First cook-Cold-buffet manageress-Cook steward-Special cook-Chief cook-Cook
http://ec.europa.eu/esco/skill/17568,Café (waiting),Restaurant assistant-Cabin attendant-Supply services staff (shipping)-Breakfast host/hostess-Attendant-Cash desk assistant (restaurant)-Meals service assistant-Serving assistant-Waiter/waitress-Head waiter-Bar assistant-Cold buffet assistant-Bartender-Cash desk assistant (cafeteria)-Waiter/waitress (ship)-Steward's assistant-Breakfast assistant-Waiter/waitress (café)
http://ec.europa.eu/esco/skill/19661,Cameras and photographic articles,"Advertising seller (door-to-door and telephone salespersons, shop sales persons and demonstrators)"
http://ec.europa.eu/esco/skill/22583,Candy and confectionery,"Advertising seller (door-to-door and telephone salespersons, shop sales persons and demonstrators)-Café assistant"
http://ec.europa.eu/esco/skill/16713,Canoeing (training/coaching),Wilderness guide-Guide-Fishing guide-Courier
http://ec.europa.eu/esco/skill/17484,Canteen kitchen (cold food preparation),Cook (ship)-Chef-Grill cook-Cold-buffet manageress (ship)-Assistant chef-Head chef-Chinese cook-First cook-Cook steward-Dietetic cook-Cold-buffet manageress-Chief cook-Cook
http://ec.europa.eu/esco/skill/17704,Canteen kitchen (cooking),Restaurant assistant-Cabin attendant-Cook (ship)-Attendant-Assistant cook-Fast-food stand assistant-Kitchen assistant-Serving assistant-Assistant chef-Chef-Head chef-Grill cook-Chinese cook-First cook-Cook steward-Dietetic cook-Kitchen assistant (institution)-Chief cook-Cook-School lunch assistant
http://ec.europa.eu/esco/skill/22415,Capability analysis,Business administrator-Quality auditor-Quality coordination adviser-Household adviser
http://ec.europa.eu/esco/skill/18767,Car disassembly,Labourer (general)
http://ec.europa.eu/esco/skill/23630,Cardiopulmonary rescuscitation,Swimming pool attendant
http://ec.europa.eu/esco/skill/15052,Care of the addicted,Psychotherapist-Psychologist-Therapist-School psychologist-Group therapist-Conversational therapist-Alcohol therapist-Individual therapist-Family therapist-Clinical psychologist-Psychoanalyst
http://ec.europa.eu/esco/skill/23091,Caretaking,Odd-job man-Water meter installer-School porter-Sports ground worker-Public baths caretaker-Caretaker (sports centre)-Caretaker (property)-Operations engineer (buildings)-Operations technician (buildings)-Meter installer-Caretaker-Cloakroom caretaker-Office caretaker-Operations manager (buildings)-Caretaker (sports ground)-Verger-Page
http://ec.europa.eu/esco/skill/17454,Caretaking (church),Water meter installer-Odd-job man-School porter-Sports ground worker-Public baths caretaker-Meter installer-Operations engineer (buildings)-Caretaker-Caretaker (property)-Operations technician (buildings)-Operations manager (buildings)-Verger
http://ec.europa.eu/esco/skill/20777,Caretaking (hospital),Page
http://ec.europa.eu/esco/skill/17448,Caretaking (school),Water meter installer-Odd-job man-School porter-Public baths caretaker-Sports ground worker-Caretaker-Operations engineer (buildings)-Meter installer-Caretaker (property)-Operations technician (buildings)-Operations manager (buildings)-Verger
http://ec.europa.eu/esco/skill/19461,Carpet cleaning,"Cleaning foreman-Cleaner (helpers and cleaners in offices, hotels and other establishments)-Cleaning instructor-Cleaner (ship)-Industry cleaner-House cleaner-Attendant-Stairs cleaner-Supervisor (cleaning)-Cleaning worker-Team supervisor (cleaning)-Head cleaner-Hospital cleaner-Office cleaner-Hotel cleaner-Aircraft cleaner"
http://ec.europa.eu/esco/skill/16475,Carpets,"Advertising seller (door-to-door and telephone salespersons, shop sales persons and demonstrators)"
http://ec.europa.eu/esco/skill/20104,Cars,"Advertising seller (door-to-door and telephone salespersons, shop sales persons and demonstrators)"
http://ec.europa.eu/esco/skill/15967,Cartography,Archaeological scientist-Natural geographer-Anthropologist-Cultural geographer-Archaeologist-Geographer-Marine archaeologist
http://ec.europa.eu/esco/skill/22334,Cash management,Union treasurer-Business administrator-Household adviser
http://ec.europa.eu/esco/skill/17431,Cash register balancing,Office cashier-Waiter/waitress-Church cashier-Farming cashier-Bartender-Cash office worker
http://ec.europa.eu/esco/skill/21432,Cashiering,"Restaurant assistant-Cleaning instructor-Cabin attendant-Supply services staff (shipping)-Advertising seller (door-to-door and telephone salespersons, shop sales persons and demonstrators)-Air traffic assistant-Ground hostess-Cook (ship)-Assistant (tourist information office)-Cottage manager-Attendant-Breakfast host/hostess-Fast-food stand assistant-Cash desk assistant (restaurant)-Café assistant-Meals service assistant-Serving assistant-Chinese cook-Grill cook-Amusement park worker-Cold-buffet manageress (ship)-Private travel agent-Travel agency assistant-Ticket seller (travel agency)-Travel agent-Dietetic cook-Charter travel salesperson-Cold-buffet manageress-Head waiter-Waiter/waitress-Traffic assistant-Leasing manager-Shop cashier-Cloakroom caretaker-Check-in assistant-Tourist information officer-Kiosk assistant-Bar assistant-Bartender-Hotel concierge-Special cook-Hotel cashier-Cash desk assistant (cafeteria)-Waiter/waitress (ship)-Auction assistant-Secretary (tourist information office)-Sales director (travel agency)-Business host/hostess-Office caretaker-Head cleaner-Bus host/hostess-Theatre cashier-Service manager (air traffic)-Travel agency employee-Restaurant cashier-Cloakroom attendant-Cinema projector operator-Traffic information officer-Business travel salesperson-Travel agency clerk-Employee (tourist information office)-Booking officer (travel agency)-Purser-Ship host/hostess-Flight attendant-Station attendant-Cook-Cashier assistant-Information cashier (shop)-Cashier-Car-park ticket seller-Booking assistant (travel agency)-Kiosk owner-Page-Breakfast assistant-School lunch assistant-Train attendant (travel attendants and travel stewards)-Cabin manager-Public baths cashier-Cinema cashier-Ticket seller-Cloakroom assistant-Cloakroom keeper-Waiter/waitress (café)"
http://ec.europa.eu/esco/skill/19716,Cataloguing (archaeological objects),Archaeological scientist-Anthropologist-Archaeologist-Marine archaeologist
http://ec.europa.eu/esco/skill/18410,Catamaran,Supply services staff (shipping)-Assistant cook (ship)-Waiter/waitress (ship)
